{
  "role": "reflector",
  "disposition": "SEAL",
  "summary": "Captured the Trail Player product concept (a real Company product for replaying sealed trails, analogous to Windows Steps Recorder, grounded in recovered export history including the RT- trail convention and the 'replay real content, never fabricate' law) and the declarative-MAUI-UI generation vision, explaining why a real hand-built screen must precede any declarative spec attempt - the same lesson the reasoning-strategy generator's own steps_description mistake already taught this session.",
  "earned_constraints": [
    "when a human corrects or refines a concept mid-session (here: 'Trail Player is a product, think Windows Step Recorder'), write it down as a real design doc before building anything - premature building on a not-yet-settled concept risks building the wrong thing twice"
  ],
  "next_seed": "Awaiting Shawn's decision: scaffold a minimal MAUI project and build one real Trail Player screen by hand (workloads confirmed available), or continue design discussion first.",
  "stop_reason": "Human decision needed before proceeding to any MAUI scaffolding - a new technology surface in this solution is a real commitment, not a silent pick.",
  "sealed": true,
  "ts": "2026-09-06T13:03:00Z"
}
