{
  "role": "reflector",
  "disposition": "RETRY",
  "summary": "All four mandate phases were executed: environment verification (with an honest 'no unittest suite exists' finding rather than a fabricated pass), a hygiene scan that found the repo had almost no dead code but a large amount of unversioned load-bearing content (now safety-netted in 4 commits), a researched and documented AG-UI/CopilotKit trail-evidence fix using Microsoft's official agent-middleware API, and this trail itself as the Phase 4 evidence record. One research error made earlier this same session (the ACTIVE_TRAIL_FILE unused-constant claim in commit c8669a9's message) was caught and is disclosed here and to the repo owner directly, not buried.",
  "earned_constraints": [
    "grep for a function/identifier by name, not by one literal string it happens to construct (ACTIVE_TRAIL_FILE was missed by grepping the literal 'active_trail_id' string instead of the identifier itself)",
    "when no .NET SDK is reachable, verify new C# API usage against a verbatim official code sample before writing code that depends on it, and say plainly that dotnet build was never run"
  ],
  "next_seed": "Run `dotnet build` (or `dotnet build ProjectName.slnx`) from the repository root on a machine with the .NET SDK installed. If it fails, the errors will point at exactly which of MafWorkflowService.cs, Program.cs, TrailRuntimeGateway.cs, or McpNativeToolProvider.cs needs correction - report them back for a fix, since none of this session's C# edits could be compiler-checked.",
  "stop_reason": "Checker recorded FAIL: the C# changes made this session (MafWorkflowService.cs, Program.cs, TrailRuntimeGateway.cs) are unverified by any compiler. This trail cannot be sealed until dotnet build actually passes.",
  "sealed": false,
  "ts": "2026-09-06T04:22:53Z"
}
