{
  "role": "reflector",
  "disposition": "SEAL",
  "summary": "Added a read-only trail-detail endpoint and wired the Trails panel to show full phase content on click, completing a first, partial pass at AGENTSKILLS-IDE.md increment 4. Verified against a real sealed trail's actual files (exact match) and a real 404 case. Playwright MCP was disconnected this session, so verification used the standalone dotnet-run technique from increment 1 instead of a live browser click-through - still real, not just a build check.",
  "earned_constraints": [
    "when a live browser actuator becomes unavailable mid-session, the standalone dotnet run + curl technique from earlier in this session is a solid fallback for real endpoint verification - don't downgrade to 'trust the build' just because the richer verification path is gone"
  ],
  "next_seed": "Remaining AGENTSKILLS-IDE.md increments: 3 (live MCP catalog, needs a live agent/chat-client context - materially larger), 5 (HIL approval surfacing), 6 (command palette), 7 (governed file mutations). None silently started - each is a real scope decision.",
  "stop_reason": null,
  "sealed": true,
  "ts": "2026-09-06T06:51:25Z"
}
