{
  "role": "reflector",
  "disposition": "SEAL",
  "summary": "The scheduled-task brief's standing item 2 (resume the pmcro-csuite/dynamic-reasoning three-package migration) turned out to already be complete, per PLAN-three-package-architecture.md's own same-day correction - there was nothing to resume. Broadened the check to the full audit section J sequence and found items 1, 2, and 3 were also already done in earlier commits this same session-day (d453611, ecefe8a, f7da58c) but never marked as such in the audit doc, which still read as an open TODO list. Fixed that drift so a future session (or Shawn) doesn't re-investigate or re-do this work. Item 5, the Federation naming/placement decision, remains genuinely open and was not resolved - it is presented as a decision for Shawn in this run's summary, per the repo's own instruction not to silently pick among legitimate options.",
  "earned_constraints": [
    "a scheduled-task brief's framing of a standing item ('resume X') can itself be stale if the repo's own design docs have moved past it same-day - verify against the design doc's current content, not the brief's framing, before doing the work it describes"
  ],
  "next_seed": "Federation decision (section 8 of AUDIT-claude-architecture-review-2026-09-06.md): decide whether 'Federation' becomes a formal rename of plugins/pmcro-csuite/, an added arbitration artifact beside it (a FederationBoard frame type for cross-Chief conflicts), or stays unused legacy vocabulary. This is a human decision, not a next autonomous-session task.",
  "stop_reason": null,
  "sealed": true,
  "ts": "2026-09-06T05:24:09Z"
}
