{
  "role": "reflector",
  "disposition": "SEAL",
  "summary": "Executed two well-scoped, evidence-backed cleanup items in response to Shawn's broad 'delete remove optimize enhance refine autonomously' mandate, deliberately not treating it as license for unbounded change: removed 4 confirmed-unreferenced generic scaffold example files (code-reviewer.md, fix-issue.md, api-design.md, testing.md), and fixed the 'omode.yaml' prose loose end across 24 files left by the pmcro-omode rename trail. This trail's own first Check attempt correctly FAILed on a real defect in its deliverables list (glob patterns and deleted-path annotations don't resolve on disk) - retried with a corrected, concrete deliverables list and sealed on a genuine PASS.",
  "earned_constraints": [
    "a Check frame's 'deliverables' field must list real, existing paths for anything still expected to exist - never a glob pattern, and never a deleted file (deletion evidence belongs in the make frame's before/after search, not the deliverable-existence check, which only verifies presence)",
    "an open-ended 'do what you think is best, autonomously' instruction is not license to invent unlimited scope - the responsible reading is to execute only items already backed by concrete evidence gathered earlier, and to say so explicitly rather than let the instruction's breadth justify guessing"
  ],
  "next_seed": "specs/csuite/*.spec.yaml's 'omode:' YAML key was deliberately left untouched - it is a structural field name whose consumers were not traced this trail (unlike the pure-prose fixes done here), so renaming it needs its own scoped look before being touched.",
  "stop_reason": null,
  "sealed": true,
  "ts": "2026-09-06T12:34:00Z"
}
