{
  "role": "reflector",
  "disposition": "SEAL",
  "summary": "Checked the 3 highest-risk preview API calls in trail 6ea25a3f's unverified C# changes against real primary sources (raw GitHub source + official docs) since no compiler is reachable from this environment. All 3 match exactly. Also documented how the existing PMCR-O lifecycle already implements Anthropic's prompt-chaining + evaluator-optimizer patterns, and that create-skill's prior simplification already followed Anthropic's 'start simple' guidance, per the repo owner's request to draw on both MAF and Anthropic agent-design practice.",
  "earned_constraints": [
    "when no compiler is reachable, primary-source API verification (raw source + official docs, cited) is legitimate risk-reduction evidence and should be recorded as such - but it is not interchangeable with a real build result, and saying so explicitly in the same document prevents a future reader from conflating the two"
  ],
  "next_seed": "Still recommended: run `dotnet build ProjectName.slnx` on a machine with the pinned 11.0.100-preview.7.26381.103 SDK to close trail 6ea25a3f for real. Confidence that it will pass is now meaningfully higher given this trail's findings, but not certain - AgentSkillsProvider/AgentFileSkillsSourceOptions usage in MafWorkflowService.CreateSkillsProvider was not checked this pass.",
  "stop_reason": null,
  "sealed": true,
  "ts": "2026-09-06T05:12:30Z"
}
