{
  "role": "reflector",
  "disposition": "BLOCKED",
  "summary": "Paused mid-implementation, not because of a technical failure but because the repo owner interrupted this session to question whether continuing to build out workspace-panel features (on top of increment 1) is the right architectural direction, and separately raised a substantial, unresolved re-framing of what Federation Board was originally meant to be - see NOTE-federation-board-original-vision-2026-09-06.md. Backend for this increment is sound and build-verified; frontend wiring is incomplete. Nothing in the working tree is broken.",
  "earned_constraints": [
    "when a repo owner interrupts mid-task to voice architectural uncertainty, stop and let them think out loud rather than defending or continuing the in-flight work - the code isn't going anywhere and a rushed 'finish what I started' response would talk over a legitimate second-guess"
  ],
  "next_seed": "Two independent follow-ups, neither to be picked up without the owner's direction: (1) finish this trail's skill-detail feature (proxy route + page.tsx wiring + live smoke test) if the owner confirms the workspace-panel direction is worth continuing; (2) have an explicit conversation about Federation Board using NOTE-federation-board-original-vision-2026-09-06.md, since it contradicts ADR-federation-csuite-decision-2026-09-06.md's resolution and that tension is unresolved.",
  "stop_reason": "Paused at the repo owner's request to discuss direction, not a technical blocker.",
  "sealed": false,
  "ts": "2026-09-06T06:01:47Z"
}
